{
  "schema_version": "ai-experiments.semantic-ir.provider-schema-capability-probe-authorization/v1",
  "authorization_id": "semantic-ir-provider-schema-capability-probe-001",
  "authorized_at": "2026-08-31T14:48:46-03:00",
  "explicit_user_authorization": true,
  "scope": "provider_schema_capability_probe_only",
  "maximum_provider_requests": 2,
  "calibration_launch_authorized": false,
  "freeze_sha256": "40b0d3e2f2041dd6deb70da5db2960afbba609a9f1757032bd684b7261e47c72"
}
